{
  "id": "7.1.1",
  "description": "Top half of a Split Wide layout. The Russian troops advance in dense ranks across broken farmland. Officers on horseback urge them forward, sabres raised, as musket smoke curls around the formation. In the foreground, Swedish defenders take cover behind a low fence, preparing to fire.",
  "narration": "Wave after wave, the Russian advance presses on.",
  "dialogs": [],
  "quotes": "",
  "info": "Page 7 â€“ Russian Advance. PageType: Split Wide (2 panels). Scene (panel 1): Russian infantry pushing forward, Swedish defenders readying counterfire."
}
