{
  "id": "5.1.2",
  "description": "Lower half of the Split Wide layout. Afternoon sunlight glints off bayonets as the Swedish column advances across open fields. Soldiers cheer as Döbeln raises his sword slightly in salute. In the distance, the small village of Jutas and scattered farm buildings come into view.",
  "narration": "Courage stirs along the line — Jutas lies ahead.",
  "dialogs": [],
  "quotes": "",
  "info": "Page 5 – March to Jutas. PageType: Split Wide (2 panels). Scene (panel 2): approaching Jutas, soldiers uplifted by Döbeln’s salute."
}
