{
  "id": "7.1.2",
  "description": "Lower half of the Split Wide layout. The Russians close in through musket smoke. Fallen soldiers lie scattered as the Swedish line braces behind hastily built defenses. A Russian officer points his sword toward the Swedish position, shouting an order as cannon fire rumbles in the distance.",
  "narration": "The air thickens with smoke and iron — the struggle for Jutas tightens.",
  "dialogs": [],
  "quotes": "",
  "info": "Page 7 – Russian Advance. PageType: Split Wide (2 panels). Scene (panel 2): close combat imminent, smoke and confusion rising over the field."
}
